{
  "format": "cognium-a11y-benchmark-result",
  "format_version": "1.0.0",
  "corpus": {
    "repository": "cogniumhq/a11y-demo",
    "revision": "af70e7c0298f8bfc266ffccfee0d5e1b40f5d62b",
    "manifest_sha256": "sha256:aaaaaaaaaaaaaaaaaaaaaaaaaaaaaaaaaaaaaaaaaaaaaaaaaaaaaaaaaaaaaaaa"
  },
  "run": {
    "id": "example-repeat-1",
    "started_at": "2026-10-12T12:00:00Z",
    "completed_at": "2026-10-12T12:00:05Z",
    "repeat": 1,
    "tool": {
      "name": "Example wrapper",
      "version": "1.0.0",
      "engine_family": "Example engine",
      "tool_surface": "CLI",
      "independence": "wrapper",
      "wrapper_of": "Example engine 4.2.0"
    },
    "environment": {
      "os": "Linux",
      "runtime": "Node.js 22",
      "browser": "Chromium",
      "browser_version": "140",
      "viewport": { "width": 1280, "height": 720 },
      "preferences": { "reduced_motion": false, "color_scheme": "light" }
    },
    "privacy": {
      "fixture_data": "public-synthetic",
      "raw_evidence_published": false
    }
  },
  "executions": [
    {
      "case_id": "keyboard-div_button",
      "case_path": "keyboard/div_button.html",
      "status": "completed",
      "declared_state": "default",
      "state_reached": true,
      "target_observability": "observed",
      "outcomes": [
        {
          "criterion": "2.1.1",
          "native_rule_id": "example-keyboard-control",
          "verdict": "fail",
          "findings": 1,
          "examined_count": 1,
          "evidence": [
            {
              "type": "digest",
              "digest": "sha256:bbbbbbbbbbbbbbbbbbbbbbbbbbbbbbbbbbbbbbbbbbbbbbbbbbbbbbbbbbbbbbbb"
            }
          ]
        }
      ]
    }
  ]
}
