{
  "format": "cognium-a11y-benchmark-result",
  "format_version": "1.0.0",
  "corpus": {
    "repository": "cogniumhq/a11y-benchmark",
    "revision": "0000000000000000000000000000000000000000",
    "manifest_sha256": "sha256:aaaaaaaaaaaaaaaaaaaaaaaaaaaaaaaaaaaaaaaaaaaaaaaaaaaaaaaaaaaaaaaa"
  },
  "run": {
    "id": "example-starter-repeat-2",
    "started_at": "2026-10-13T09:00:00Z",
    "completed_at": "2026-10-13T09:04:00Z",
    "repeat": 2,
    "tool": {
      "name": "Example product",
      "version": "0.0.0",
      "engine_family": "Example engine",
      "tool_surface": "CLI",
      "independence": "independent-engine"
    },
    "environment": {
      "os": "Linux",
      "runtime": "Node.js 22",
      "browser": "Chromium",
      "browser_version": "140",
      "viewport": {
        "width": 1280,
        "height": 720
      },
      "preferences": {
        "reduced_motion": false,
        "color_scheme": "light"
      }
    },
    "privacy": {
      "fixture_data": "public-synthetic",
      "raw_evidence_published": false
    }
  },
  "executions": [
    {
      "case_id": "aaa-abbreviations",
      "case_path": "aaa/abbreviations.html",
      "status": "completed",
      "declared_state": "default",
      "state_reached": true,
      "target_observability": "observed",
      "outcomes": [
        {
          "criterion": "3.1.4",
          "native_rule_id": "example.3-1-4",
          "verdict": "fail",
          "findings": 1,
          "examined_count": 27,
          "evidence": [
            {
              "type": "digest",
              "digest": "sha256:041eb25a81ca585efc76253cf367ac4ae08377f6c5162e23489a701086029e06"
            }
          ]
        }
      ]
    },
    {
      "case_id": "aaa-safe_abbreviations",
      "case_path": "aaa/safe_abbreviations.html",
      "status": "completed",
      "declared_state": "default",
      "state_reached": true,
      "target_observability": "observed",
      "outcomes": [
        {
          "criterion": "3.1.4",
          "native_rule_id": "example.3-1-4",
          "verdict": "pass",
          "findings": 0,
          "examined_count": 67,
          "evidence": [
            {
              "type": "digest",
              "digest": "sha256:b8270947588c20dbd1bf6cd394e7afccb7e40613cc9383c96ee2ad8128d2b119"
            }
          ]
        }
      ]
    },
    {
      "case_id": "guided-caption_quality",
      "case_path": "guided/caption_quality.html",
      "status": "unsupported",
      "declared_state": "default",
      "state_reached": false,
      "target_observability": "unknown",
      "outcomes": []
    },
    {
      "case_id": "journey-booking-broken",
      "case_path": "journeys/booking/broken/index.html",
      "status": "blocked",
      "declared_state": "default",
      "state_reached": false,
      "target_observability": "not-observed",
      "outcomes": []
    },
    {
      "case_id": "keyboard-div_button",
      "case_path": "keyboard/div_button.html",
      "status": "completed",
      "declared_state": "default",
      "state_reached": true,
      "target_observability": "observed",
      "outcomes": [
        {
          "criterion": "2.1.1",
          "native_rule_id": "example.2-1-1",
          "verdict": "fail",
          "findings": 1,
          "examined_count": 27,
          "evidence": [
            {
              "type": "digest",
              "digest": "sha256:e99b6a954bbf3693f3703c3fa78c3608989dd1c74ded617978636571bb2b8781"
            }
          ]
        },
        {
          "criterion": "4.1.2",
          "native_rule_id": "example.4-1-2",
          "verdict": "fail",
          "findings": 1,
          "examined_count": 27,
          "evidence": [
            {
              "type": "digest",
              "digest": "sha256:e99b6a954bbf3693f3703c3fa78c3608989dd1c74ded617978636571bb2b8781"
            }
          ]
        }
      ]
    },
    {
      "case_id": "keyboard-safe_native_button",
      "case_path": "keyboard/safe_native_button.html",
      "status": "completed",
      "declared_state": "default",
      "state_reached": true,
      "target_observability": "observed",
      "outcomes": [
        {
          "criterion": "2.1.1",
          "native_rule_id": "example.2-1-1",
          "verdict": "pass",
          "findings": 0,
          "examined_count": 23,
          "evidence": [
            {
              "type": "digest",
              "digest": "sha256:7bee403dd703ff4b28080ca29ca335ebc1681e90d699b1650dd6d3a0eaaf71ed"
            }
          ]
        },
        {
          "criterion": "4.1.2",
          "native_rule_id": "example.4-1-2",
          "verdict": "cannot-tell",
          "findings": 0,
          "examined_count": 23,
          "evidence": [
            {
              "type": "manual-note",
              "note": "the example adapter declines to decide this case"
            }
          ]
        }
      ]
    },
    {
      "case_id": "patterns-disclosure",
      "case_path": "patterns/disclosure.html",
      "status": "completed",
      "declared_state": "default",
      "state_reached": true,
      "target_observability": "observed",
      "outcomes": [
        {
          "criterion": "4.1.2",
          "native_rule_id": "example.4-1-2",
          "verdict": "fail",
          "findings": 1,
          "examined_count": 30,
          "evidence": [
            {
              "type": "digest",
              "digest": "sha256:a456b11c1349c6ee3b56ba09e739f71597899c4c9bf86dc8bf68e478f9a9a219"
            }
          ]
        },
        {
          "criterion": "2.1.1",
          "native_rule_id": "example.2-1-1",
          "verdict": "fail",
          "findings": 1,
          "examined_count": 30,
          "evidence": [
            {
              "type": "digest",
              "digest": "sha256:a456b11c1349c6ee3b56ba09e739f71597899c4c9bf86dc8bf68e478f9a9a219"
            }
          ]
        }
      ]
    },
    {
      "case_id": "patterns-safe_disclosure",
      "case_path": "patterns/safe_disclosure.html",
      "status": "completed",
      "declared_state": "default",
      "state_reached": true,
      "target_observability": "observed",
      "outcomes": [
        {
          "criterion": "4.1.2",
          "native_rule_id": "example.4-1-2",
          "verdict": "pass",
          "findings": 0,
          "examined_count": 30,
          "evidence": [
            {
              "type": "digest",
              "digest": "sha256:1e83bc1effafb2e5cb1a4c3f6b47c9d16d169797904df90d120bc9df9a557edb"
            }
          ]
        },
        {
          "criterion": "2.1.1",
          "native_rule_id": "example.2-1-1",
          "verdict": "pass",
          "findings": 0,
          "examined_count": 30,
          "evidence": [
            {
              "type": "digest",
              "digest": "sha256:1e83bc1effafb2e5cb1a4c3f6b47c9d16d169797904df90d120bc9df9a557edb"
            }
          ]
        }
      ]
    },
    {
      "case_id": "pipeline-observed_pass-control",
      "case_path": "pipeline/vacuous/observed-control.html",
      "status": "completed",
      "declared_state": "default",
      "state_reached": true,
      "target_observability": "observed",
      "outcomes": [
        {
          "criterion": "1.1.1",
          "native_rule_id": "example.applicability",
          "verdict": "inapplicable",
          "findings": 0,
          "examined_count": 24,
          "evidence": [
            {
              "type": "manual-note",
              "note": "no criterion under test applies to this fixture"
            }
          ]
        }
      ]
    },
    {
      "case_id": "pipeline-vacuous_pass",
      "case_path": "pipeline/vacuous/zero-examined.html",
      "status": "completed",
      "declared_state": "default",
      "state_reached": true,
      "target_observability": "observed",
      "outcomes": [
        {
          "criterion": "1.1.1",
          "native_rule_id": "example.applicability",
          "verdict": "inapplicable",
          "findings": 0,
          "examined_count": 24,
          "evidence": [
            {
              "type": "manual-note",
              "note": "no criterion under test applies to this fixture"
            }
          ]
        }
      ]
    }
  ]
}
